Exercise_ID,Exercise_Name,Affected_Muscle,Gender,Goal,Exercise_area,Description,Link,Level,Sets,Reps,Rep_time,Rest_time,exercise_type
81,side plank,ABS; forearm,male; female,Lose weight; Endurance,Home; Gym,Holding a plank on one side. It works the abs and forearms.,https://www.youtube.com/watch?v=0Rl5ZQwmS-o,Medium,3,10,3,60,Main
82,glute bridges,glute; lower back,male; female,Lose weight; Endurance,Home; Gym,Lifting the hips while lying on your back. It targets the glutes and back.,https://www.youtube.com/watch?v=WtilA9IJX1c,Easy,3,12,3,60,Main
83,russian twists,ABS,male; female,Lose weight; Endurance,Home; Gym,Sitting down and twisting the torso side to side. It focuses on the abs.,https://www.youtube.com/watch?v=DJQGX2J4IVw,Medium,3,12,3,60,Main
84,squat pulse,leg; glute,male; female,Lose weight; Endurance,Home; Gym,Squatting and pulsing up and down. It targets the legs and glutes.,https://www.youtube.com/watch?v=7HarjcM6b10,Easy,2,10,10,60,Main
85,sprawls,leg; ABS; forearm; shoulder,male; female,Lose weight; Endurance,Home; Gym,"A fast movement dropping into a plank from standing. It focuses on the legs, abs, forearms, shoulders, and back.",https://www.youtube.com/watch?v=UFFODmd6RTc,Medium,3,10,3,60,Main
86,leg raises,leg; ABS,male; female,Lose weight; Endurance,Home; Gym,Lifting legs from the floor while lying on your back. It works the legs and abs.,https://www.youtube.com/watch?v=Wp4BlxcFTkE,Medium,3,10,3,60,Main
87,dead bug,ABS,male; female,Lose weight; Endurance,Home; Gym,Alternating opposite arm and leg lifts. It targets the abs and back.,https://www.youtube.com/watch?v=g_BYB0R-4Ws,Medium,3,10,3,60,Main
88,scissor kicks,leg; ABS,male; female,Lose weight; Endurance,Home; Gym,Alternating legs in a fluttering motion. It works the legs and abs.,https://www.youtube.com/watch?v=IBS84c5uA_A,Medium,3,10,3,60,Main
89,overhead squat,leg; ABS; forearm; shoulder,male; female,Lose weight; Endurance,Home; Gym,"Squatting with arms extended overhead. It targets the legs, abs, forearms, shoulders, and back.",https://www.youtube.com/watch?v=pn8mqlG0nkE,Easy,2,8,10,60,Main
90,jump lunges,leg; ABS,male; female,Lose weight; Endurance,Home; Gym,Alternating lunges with jumps. It targets the legs and abs.,https://www.youtube.com/watch?v=O-rntsAALBo,Easy,3,10,3,60,Main
91,side-to-side jumps,leg; glute,male; female,Lose weight; Endurance,Home; Gym,Jumping laterally from side to side. It works the legs and glutes.,https://www.youtube.com/watch?v=sf23wNksjtk,Easy,4,12,3,60,Main
92,plank up-downs,ABS; forearm,male; female,Lose weight; Endurance,Home; Gym,Transitioning between forearm and full plank. It targets the abs and forearms.,https://www.youtube.com/watch?v=jF3wvzUUw7s,Medium,1,1,30,0,Main
93,farmer's walk,ABS; forearm,male; female,Lose weight; Endurance,Home; Gym,"Walking while holding heavy weights. It focuses on the abs, forearms, and back.",https://www.youtube.com/watch?v=8OtwXwrJizk,Medium,2,1,30,60,Main
94,toe touches,leg; ABS,male; female,Lose weight; Endurance,Home; Gym,Lifting legs and touching toes with hands. It works the legs and abs.,https://www.youtube.com/watch?v=9iEI95-eZWk,Medium,3,10,3,60,Main
95,star plank,ABS; forearm,male; female,Lose weight; Endurance,Home; Gym,Holding a plank with arms and legs spread wide. It targets the abs and forearms.,https://www.youtube.com/watch?v=V8z8A2WwNnA,Medium,1,1,30,0,Main
96,plank tucks,leg; ABS,male; female,Lose weight; Endurance,Home; Gym,Jumping feet toward hands while in a plank. It focuses on the legs and abs.,https://www.youtube.com/watch?v=ydtRvYqG1bA,Easy,3,10,3,60,Main
97,side shuffles,leg,male; female,Lose weight; Endurance,Home; Gym,Moving quickly from side to side. It targets the legs.,https://www.youtube.com/watch?v=y-yPka1hGws,Easy,3,10,3,60,Main
98,dumbbell snatch,leg; forearm,male; female,Lose weight; Endurance,Home; Gym,"Lifting a dumbbell from the floor to overhead. It targets the legs, forearms, and back.",https://www.youtube.com/watch?v=xA_DpewzL7c,Difficulty,3,10,3,60,Main
99,dumbbell thrusters,leg; ABS; forearm; shoulder,male; female,Lose weight; Endurance,Home; Gym,"A squat followed by an overhead press. It works the legs, abs, forearms, shoulders, and back.",https://www.youtube.com/watch?v=-rHJkjHUbmo,Medium,3,12,3,60,Main
100,dumbbell shoulder press, shoulder,male; female,Muscle gain,Gym; Home,"To perform this exercise, sit on a chair with your back straight and hold a dumbbell in each hand at shoulder level, with your elbows bent at 90 degrees. Exhale as you push the dumbbells upward until your arms are fully extended. Hold for a moment, then inhale and lower the dumbbells back to shoulder level. Repeat the steps for the desired number of repetitions.",https://www.youtube.com/shorts/E9ShwbwZ1zw,Medium,3,12,3,60,Main
101,seated barbell shoulder press, shoulder,male,Muscle gain,Gym,"To perform this exercise, sit upright on a chair and grip the barbell with your hands slightly wider than shoulder-width apart. Lift the barbell off the rack and raise it straight above your head. Slowly lower the barbell down to shoulder level. Repeat the lifting and lowering motion for the desired number of repetitions.",https://www.youtube.com/shorts/8XdAwwbL5kk,Difficulty,3,12,3,60,Main
102,smith machine overhead shoulder press, shoulder,male,Muscle gain,Gym,"To perform this exercise, sit on the Smith machine, take a deep breath, and push the barbell up from the initial locked position, keeping your arms straight but without locking your elbows. Engage your shoulder muscles as you lower the barbell to chin level, pausing briefly. Then, apply force to push the barbell back to the starting position. Repeat the steps for the desired number of repetitions.",https://www.youtube.com/shorts/ZmyLFsowxsg,Medium,4,12,3,60,Main
103,barbell front raise, shoulder,male,Muscle gain,Gym,"To perform this exercise, firmly grip the barbell with your palms facing down and your elbows straight. Slightly arch your  chest and pull your shoulders back while keeping your back straight and core engaged. Lift the barbell in front of you until your hands are higher than your shoulders. Hold for a moment, then slowly lower it back to the starting position. Repeat the movement for the desired number of repetitions.",https://www.youtube.com/shorts/1ucaWr-WKMQ,Medium,3,12,3,60,Main
104,dumbbell front raise, shoulder,male; female,Muscle gain,Gym; Home,"To perform this exercise, stand upright with your feet shoulder-width apart. Hold a dumbbell in each hand with your arms straight down in front of your thighs. Lift the dumbbell in your right hand in front of you with your palm facing down, while your left hand remains in the starting position. Hold for a moment, then slowly lower the right dumbbell. Repeat the movement with your left hand. Alternate and repeat for the desired number of repetitions.",https://www.youtube.com/shorts/_6oXH8ZbB5M,Easy,4,12,3,60,Main
105,dumbbell lateral raise, shoulder,male; female,Muscle gain,Gym; Home,"To perform this exercise, stand upright with your feet shoulder-width apart, holding a dumbbell in each hand at your sides. Lift the dumbbells up to shoulder level, holding this position for a moment. Then, lower the dumbbells back to the starting position. Repeat the movement for the desired number of repetitions.",https://www.youtube.com/shorts/YvTkK72atZk,Easy,4,12,3,60,Main
106,cable lateral raise, shoulder,male,Muscle gain,Gym,"To perform this exercise, stand upright with your feet shoulder-width apart. Hold the cable handle with one hand, while placing the other hand on your hip. Pull the cable to the side until your arm is fully extended and parallel to the floor. Hold for a moment, then lower your arm back to the starting position. Repeat the movement with the other hand, alternating for the desired number of repetitions.",https://www.youtube.com/shorts/X8tZOGFovj0,Medium,3,12,3,60,Main
107,barbell upright row, shoulder,male,Muscle gain,Gym; Home,"To perform this exercise, stand upright with your feet hip-width apart, holding a barbell in both hands resting against your thighs, with your palms facing inward. Lift the barbell to shoulder level, keeping your elbows slightly higher than your forearms and pointing out to the sides. Lower the barbell back to the starting position and repeat the movement for the desired number of repetitions.",https://www.youtube.com/shorts/AWsGWt-VMl8,Difficulty,3,10,3,60,Main
108,cable upright row, shoulder,male,Muscle gain,Gym,"To perform this exercise, stand upright with your feet shoulder-width apart, holding the cable handles in both hands. Pull the weight upward until your trapezius muscles are fully contracted. Hold for a moment, then lower the weight back to the starting position. Repeat the movement for the desired number of repetitions.",https://www.youtube.com/shorts/ueU1cra8lA0,Medium,3,12,3,60,Main
109,dumbbell upright row, shoulder,male; female,Muscle gain,Gym,"To perform this exercise, stand upright with a dumbbell in each hand, arms straight down by your sides, and palms facing your body. Raise the dumbbells until they are close to your chin, bending your elbows and keeping them pointing upward. Hold for a moment, then lower the dumbbells back to the starting position. Repeat the movement for the desired number of repetitions.",https://www.youtube.com/shorts/Ti3OfEu_CKU,Easy,4,10,3,60,Main
110,cable face pull, shoulder,male; female,Muscle gain,Gym,"To perform this exercise, stand upright and adjust the cable to face level. Engage your core and pull the cable toward your face, squeezing your shoulder blades together. Hold this position for a moment, then release the cable back to the starting position. Repeat the movement for the desired number of repetitions.",https://www.youtube.com/shorts/qEyoBOpvqR4,Medium,3,12,3,60,Main
111,seated cable face pull, shoulder,male; female,Muscle gain,Gym,"To perform this exercise, sit upright on a bench, gripping the cable handle with both hands and palms facing inward. Pull the cable towards your face, ensuring your elbows are higher than your shoulders. Hold this position for a moment, then release the cable back to the starting position. Repeat the movement for the desired number of repetitions.",https://www.youtube.com/shorts/b5le--KkyH0,Medium,3,10,3,60,Main
112,banded face pulls, shoulder,male; female,Muscle gain,Gym,"To perform this exercise, stand upright with your feet shoulder-width apart, gripping the resistance band with both hands and palms facing your body. Pull the band back while keeping your elbows higher than your shoulders. Hold this position for a moment, squeezing your shoulder blades tightly. Release your arms back to the starting position and repeat the movement for the desired number of repetitions.",https://www.youtube.com/shorts/DVxfKB0BnlY,Easy,4,12,3,60,Main
113,dumbbell rear delt lateral raise, shoulder,male; female,Muscle gain,Gym; Home,"To perform this exercise, sit on a bench with your feet together, holding a dumbbell in each hand with your palms facing inward. Lean forward slightly, bend your elbows, and lift the dumbbells out to the sides. Lower the dumbbells back to the starting position and repeat the movement for the desired number of repetitions.",https://www.youtube.com/shorts/KoRDmXocJII,Medium,4,12,3,60,Main
114,rear delt machine fly, shoulder,male; female,Muscle gain,Gym,"To perform this exercise, sit on the machine facing inward, gripping the handles firmly with both hands. Engage your shoulder muscles and extend your arms back. Return your arms to the starting position and repeat the movement for the desired number of repetitions.",https://www.youtube.com/shorts/v0CxZlWX9zQ,Medium,4,10,3,60,Main
115,dumbbell push press, shoulder,male; female,Muscle gain,Gym; Home,"Stand with feet shoulder-width apart, holding a dumbbell in each hand. Keep forearms perpendicular to the floor, arms close to your sides. Exhale, lower into a half squat, then stand up, pressing one arm overhead. Slowly return your arm to the starting position and repeat.",https://www.youtube.com/watch?v=vuaYVK8xyqo,Medium,3,12,3,60,Main
116,arnold dumbbell press, shoulder,male,Muscle gain,Gym; Home,"Hold the dumbbells on your thighs, feet shoulder-width apart. Use your thighs to lift the dumbbells to your shoulders, rotating your palms inward. Inhale, brace your shoulders and back, and press the weights up, rotating palms outward until the dumbbells nearly touch (without locking elbows). Exhale and hold briefly. Inhale, brace your shoulders, and slowly lower the weights, rotating palms inward back to the start.",https://www.youtube.com/watch?v=pQDrcNoDNVM,Medium,3,10,3,60,Main
117,barbell military press, shoulder,male,Muscle gain,Gym,"Sit upright on a bench (use a rack if available) with the barbell above head height. Grip the bar slightly wider than shoulder-width with palms facing forward. Lift the bar overhead. Inhale, then slowly lower it to shoulder level. Exhale and press the bar back overhead, keeping your torso steady and back straight.",https://www.youtube.com/shorts/1M6JMpgAtS0,Difficulty,4,12,3,60,Main
118,lunging shoulder press, shoulder,female,Muscle gain,Gym; Home,"Stand with feet shoulder-width apart, holding a dumbbell over your left shoulder. Step forward with your right leg, lowering into a lunge until your thigh is parallel to the floor, while pressing the dumbbell overhead. Hold for 5 seconds, then return to the starting position. Repeat with the opposite leg.",https://www.youtube.com/shorts/-jkNM2Z4XO8,Medium,3,10,3,60,Main
119,landmine press, shoulder,male,Muscle gain,Gym,"Stand upright, holding a barbell with weight on one side, resting it on your shoulder. Lower into a squat, then stand up quickly while pressing the bar overhead. Hold for 1–2 seconds, then slowly lower it back to shoulder level.",https://www.youtube.com/watch?v=XQJIaWGScrA,Difficulty,3,10,3,60,Main
120,front plate raises, shoulder,male,Muscle gain,Gym; Home,"Stand upright with feet shoulder-width apart, holding a weight plate with both hands, arms extended with a slight bend at the elbows and the plate near your hips. Exhale and gradually lift the plate until your arms are parallel to the floor, holding it for 1 second with a stable torso and straight back. Inhale and lower the plate back to the starting position.",https://www.youtube.com/watch?v=FbkDVvHKrgE,Medium,4,12,3,60,Main
121,reverse dumbbell flyes, shoulder,male,Muscle gain,Gym; Home,"Stand upright with feet shoulder-width apart, holding a dumbbell in each hand. Lean forward until your torso is nearly parallel to the floor, with a slight bend in your knees and arms extended in front. Exhale and engage your shoulders to raise both arms out to the side until they are parallel to the floor, keeping a slight bend in the elbows. Inhale and slowly return to the starting position.",https://www.youtube.com/shorts/A-x6_0VrT18,Medium,3,10,3,60,Main
122,bent-over row,middle back; lower back,male,Muscle gain,Gym,This exercise involves hinging at the hips and rowing a weight towards your torso. It targets the middle and lower back muscles.,https://youtu.be/6gvmcqr226U,Medium,4,12,3,60,Main
123,lat pulldown,upper back,male; female,Muscle gain,Gym,"Using a lat pulldown machine, pull the bar down towards your  chest. This exercise targets the latissimus dorsi muscles.",https://youtu.be/7JnP8dFbS14,Easy,4,12,3,60,Main
124,seated cable row,middle back,male; female,Muscle gain,Gym,Sit on a seated cable row machine and pull the handle towards your torso. This exercise targets the middle back muscles.,https://youtu.be/lJoozxC0Rns,Easy,4,12,3,60,Main
125,pull-apart,middle back,female,Muscle gain,Home,"Using a resistance band, pull the band apart in front of you. This exercise targets the rear delts and middle back muscles.",https://youtu.be/0Po47vvj9g4,Easy,4,12,3,60,Main
126,superman,lower back,male; female,Muscle gain,Home,Lie face down on the floor and lift your arms and legs simultaneously. This exercise targets the lower back muscles.,https://youtu.be/kTMBsUwEGPM,Easy,4,12,3,60,Main
127,good morning,lower back,male; female,Muscle gain,Gym,Hinge at the hips and lower your torso towards the ground. This exercise targets the hamstrings and lower back muscles.,https://youtu.be/wUbsMNkkpLk,Difficulty,4,12,3,60,Main
128,t-bar row,"upper back, middle back",male,Muscle gain,Gym,"Using a T-bar row attachment, pull the weight towards your torso. This exercise targets the upper and middle back muscles.",https://youtu.be/hYo72r8Ivso,Difficulty,4,12,3,60,Main
129,pull-up,upper back,male,Muscle gain; Endurance,Gym,This exercise targets the upper back muscles.,https://youtu.be/PHdHnZcbsB8,Difficulty,4,12,3,60,Main
130,dumbbell row,upper back,male; female,Muscle gain,Home,This exercise targets the upper back muscles using dumbbells.,https://youtu.be/6gvmcqr226U,Medium,4,12,3,60,Main
131, chest supported row,middle back,male,Muscle gain,Gym,"Lie face down on a bench, using your hands to support your upper body against the edge of a table. Pull the dumbbells toward your stomach.",https://youtu.be/Nx0TzjgsI-0,Difficulty,4,12,3,60,Main
132,inverted row,"middle back, lower back",male; female,Muscle gain,Gym,"Lie under a bar, grip the bar with both hands and pull your body up.",https://youtu.be/0AsxBmXeOIo,Medium,4,12,3,60,Main
133,hyperextension,lower back,male; female,Muscle gain,Gym,"Lie face down on a hyperextension machine, raising your upper body.",https://youtu.be/81riMKjNBuA,Easy,4,12,3,60,Main
134,renegade row,"middle back, ABS",male; female,Muscle gain,Home,"In a push-up position, pull the dumbbells toward your body one at a time.",https://youtu.be/Q28cLuweLv4,Medium,4,12,3,60,Main
135,face pull,shoulder; upper back,male; female,Muscle gain,Gym,"Sit on a cable machine, pull the cable toward your face.",https://youtu.be/0Po47vvj9g4,Easy,3,12,3,60,Main
136,low row,"middle back, lower back",male,Muscle gain,Gym,"Sit on a low row machine, pull the handles toward your stomach.",https://youtu.be/opjbouBmUWg,Easy,3,12,3,60,Main
137,bent-over reverse fly, shoulder,male; female,Muscle gain,Gym; Home,"Bend forward, holding the dumbbells with both hands and extending them out to the sides.",https://youtu.be/hf7jnF45N_I,Easy,4,12,3,60,Main
138,one-arm dumbbell row on bench,middle back,male; female,Muscle gain,Gym,"Place one foot on a bench, use your hands to support the bench and pull the dumbbells toward your body.",https://youtu.be/DMo3HJoawrU,Medium,4,12,3,60,Main
139,trap bar deadlift,"lower back, glute, leg",male; female,Muscle gain,Gym,"Variation of the deadlift, reducing stress on the spine.",https://youtu.be/v709aJKv-gM,Difficulty,3,12,3,60,Main
140,barbell shrug,shoulder,male,Muscle gain,Gym,"Stand upright, holding dumbbells in both hands and raising your shoulders.",https://youtu.be/larn3Asl6oM,Medium,3,12,3,60,Main
141,dumbbell shrug,shoulder,male,Muscle gain,Home,Similar to a barbell shrug but using dumbbells.,https://youtu.be/_t3lrPI6Ns4,Medium,3,12,3,60,Main
142,pull-up with a wide grip,upper back,male,Muscle gain,Gym,Pull-ups with hands wider than shoulder-width apart.,https://youtu.be/GRgWPT9XSQQ,Difficulty,3,12,3,60,Main
143,pull-up with a narrow grip,upper back; bicep,male,Muscle gain,Gym,Pull-ups with hands narrower than shoulder-width apart.,https://youtu.be/VuIkwZEEdEQ,Difficulty,3,12,3,60,Main
144,lat pulldown behind the neck,upper back,male; female,Muscle gain,Gym,"Lat pulldowns with the bar behind your neck. Note: This exercise can put stress on your shoulders, so be careful.",https://youtu.be/Ln150SZDBxQ,Easy,4,12,3,60,Main
145,seated cable row with neutral grip,middle  back,male; female,Muscle gain,Gym,"Sitting on a cable machine, pull the cable toward your body with a neutral grip.",https://youtu.be/UCXxvVItLoM,Easy,4,12,3,60,Main
146,dumbbell bench press,middle chest; shoulder; tricep; bicep,male; female,Muscle gain,Gym,"The dumbbell bench press is an upper-body exercise where you lie on a bench and press dumbbells upwards from  chest level, targeting the  chest, shoulders, and triceps.",https://www.youtube.com/watch?v=YQ2s_Y7g5Qk,Medium,3,12,3,60,Main
147,cable crossover,middle chest; shoulder; tricep; bicep,male,Muscle gain,Gym,"The cable crossover is a strength training exercise that targets the  chest muscles by pulling cables across the body from both sides, focusing on developing the pectoral muscles.",https://www.facebook.com/watch/?v=1478474179004001,Medium,4,12,3,60,Main
148,chest press machine,middle chest; shoulder; tricep; bicep,male; female,Muscle gain,Gym,"The  chest Press Machine is a Gym equipment designed to strengthen the  chest, shoulders, and triceps by simulating a bench press movement while providing stability and support.",https://www.youtube.com/watch?v=TqR3Le8Ta2w,Medium,4,12,3,60,Main
149,dumbbell flye,middle chest,male,Muscle gain,Gym,"The Dumbbell Flye is a  chest exercise where you lie on a bench, holding a dumbbell in each hand, and lower your arms in a wide arc before bringing them back together, keeping a slight bend in your elbows.",https://www.youtube.com/watch?v=JFm8KbhjibM,Medium,4,12,3,60,Main
150,barbell bench press,middle chest; shoulder; tricep; bicep,male; female,Muscle gain,Gym,"Lie on a flat bench, holding a barbell above your  chest. Lower the barbell to your  chest, then press it back up. Focus on your  chest, triceps, and front delts.",https://www.youtube.com/watch?v=hWbUlkb5Ms4,Medium,3,12,3,60,Main
151,decline barbell bench press,lower chest; shoulder; tricep,male,Muscle gain,Gym,"Lie on a decline bench with a barbell held above your  chest. This focuses on: Lower  chest, triceps.",https://www.youtube.com/watch?v=UH3w618WAAc&t=6s,Difficulty,3,12,3,60,Main
152,straight arm dumbbell pullover,lower chest; shoulder; tricep,male,Muscle gain,Gym,"Lower the barbell towards your  chest, then press it back up.",https://www.youtube.com/watch?v=T8DM2kKzT_0,Medium,3,12,3,60,Main
153,overhead press,shoulder; upper back; tricep,male,Muscle gain; Endurance,Gym,"Lie on a flat bench, holding a barbell above your  chest. Press the barbell straight up until your arms are fully extended. Focus on your shoulders, triceps, and upper  chest.",https://www.tiktok.com/@infinityacademyvn/video/7340688622670204178,Difficulty,3,12,3,60,Main
154,chest dips,lower chest; shoulder; tricep,male,Mucle gain; Endurance,"Gym
"," chest dips are a bodyweight exercise primarily targeting the  chest muscles, especially the lower  chest. To perform, grip parallel bars or a sturdy chair, lower your body until your elbows form a 90-degree angle, then push back up.",https://www.youtube.com/watch?v=2HYAeF6o7Bc,Difficulty,4,12,3,60,Main
155,incline dumbbell press,upper chest; shoulder; tricep,male,Muscle gain,Gym,The Incline Dumbbell Press is a  chest exercise that primarily targets the upper  chest muscles. It involves lying on an incline bench and pressing a dumbbell in each hand upwards. This exercise also works the shoulders and triceps.,https://www.youtube.com/watch?v=oZVCBM9f8Eo,Medium,4,12,3,60,Main
156,incline barbell bench press,upper chest; shoulder; tricep,male,Muscle gain,Gym,"The Incline Barbell Bench Press is a  chest exercise that targets the upper portion of the pectoral muscles. Performed on an incline bench, this movement also engages the shoulders and triceps as you press the barbell upwards from the  chest. It's excellent for building upper  chest strength and mass.",https://www.youtube.com/watch?v=2jFFCy8JBU8,Medium,4,12,3,60,Main
157,decline dumbbell press,lower chest; shoulder; tricep,male,Muscle gain,Gym,"The Decline Dumbbell Press is a  chest exercise performed on a decline bench, where you press dumbbells upward from a declined angle. It primarily targets the lower portion of the pectoral muscles ( chest) while also engaging the triceps and shoulders for support. This movement helps build  chest definition and strength in the lower  chest area.",https://www.youtube.com/watch?v=_APcTa8ni3o,Medium,4,12,3,60,Main
158,incline dumbbell flyes,upper chest; shoulder; tricep,male,Muscle gain,Gym,"Incline Dumbbell Flyes is a  chest exercise performed on an incline bench. You lower the dumbbells out to the sides with a slight bend in your elbows, then bring them back together. This movement targets the upper portion of the  chest (pectorals) and also engages the shoulders and stabilizing muscles. It helps build  chest width and definition.",https://www.youtube.com/watch?v=JSDpq14vCZ8,Medium,3,12,3,60,Main
159,decline dumbbell flyes,lower chest; shoulder; tricep,male,Muscle gain,Gym,"Decline Dumbbell Flyes is an isolation exercise targeting the lower  chest. Performed on a decline bench, you hold dumbbells with a slight bend in your elbows, lowering them out to the sides in an arc motion, and then bringing them back together above your  chest. This movement stretches and contracts the lower pectoral muscles, enhancing their definition and strength",https://www.youtube.com/watch?v=HBzfHrehHj4,Difficulty,3,12,3,60,Main
160,low cable flyes,lower chest,male,Muscle gain,Gym,"Low Cable Flyes is an isolation exercise that targets the  chest muscles, particularly the pectoralis major. Using a cable machine, you start with the cables set at a low position and pull them upward in an arc, keeping a slight bend in your elbows. This motion emphasizes the inner  chest and helps improve muscle definition and stability. It's commonly used to enhance the overall shape of the  chest.",https://www.tiktok.com/@renshawspt_official/video/7199073211575848235,Medium,4,12,3,60,Main
