Exercise_ID,Exercise_Name,Affected_Muscle,Gender,Goal,Exercise_area,Description,Link,Level,Sets,Reps,Rep_time,Rest_time,exercise_type
161,high cable flyes,middle chest,male,Muscle gain,Gym,"High Cable Flyes is an exercise that targets the upper  chest and shoulders. Using a cable machine, you adjust the pulleys to a high position, grasp the handles, and pull them down and together in an arc-like motion. This movement helps isolate the pectoral muscles and enhances muscle definition while providing constant tension throughout the range of motion.",https://www.youtube.com/watch?v=Fa2d4Jr_ic8,Medium,4,12,3,60,Main
162,chest thrust,middle chest; shoulder,male; female,Muscle gain,Gym,"The Pec Deck Machine is a Gym equipment used to isolate and strengthen the  chest muscles, particularly the pectoralis major. To perform the exercise, sit on the machine with your back against the pad, grip the handles, and bring them together in front of your  chest. This movement effectively targets the inner  chest and helps improve muscle definition and size. It's suitable for both beginners and advanced lifters.",https://www.youtube.com/watch?v=g3T7LsEeDWQ,Easy,4,12,3,60,Main
163,incline push-ups,upper chest; shoulder; tricep,male; female,Mucle gain; Endurance,Gym; Home,"Incline Push-ups are a variation of standard push-ups where your hands are placed on an elevated surface, such as a bench or step. This position reduces the difficulty compared to regular push-ups and primarily targets the upper  chest (pectoralis major) and shoulders (deltoids). They also engage the core for stability. Incline push-ups are great for building strength and muscle endurance, especially for beginners or those recovering from injury.",https://www.youtube.com/watch?v=Gvm5Q29UHbk,Easy,4,12,3,60,Main
164,decline machine press,lower chest; shoulder; tricep,male,Muscle gain,Gym,"The Decline Machine Press is a strength training exercise targeting the lower portion of the pectoral muscles. Performed on a decline bench, it involves pressing a weight (usually on a machine) away from your  chest while seated. This movement emphasizes the lower  chest and helps build overall  chest strength and muscle definition. It's a safer alternative to free weights for isolating the  chest muscles.",https://www.youtube.com/watch?v=qTX2OlhSsnc,Difficulty,4,12,3,60,Main
165,smith machine bench press,middle chest; shoulder; tricep,male,Muscle gain,Gym,"The Smith Machine Bench Press is a weightlifting exercise that involves lying on a bench and pressing a barbell attached to a Smith machine. This machine stabilizes the bar, allowing for a controlled movement. It primarily targets the pectoralis major ( chest muscles), while also engaging the triceps and shoulders. Th",https://www.youtube.com/watch?v=PC91ivqIAe4,Difficulty,4,12,3,60,Main
166,smith machine incline press,upper chest; shoulder; tricep,male,Muscle gain,Gym,"The Smith Machine Incline Press is an exercise targeting the upper  chest, shoulders, and triceps. It involves lying on an inclined bench set at about 30 to 45 degrees and pressing a barbell attached to a Smith machine upward. The guided movement provides stability, making it easier to focus on the pressing motion and effectively isolate the upper pectoral muscles.",https://www.youtube.com/watch?v=OXc8Xi2tcXk,Easy,4,12,3,60,Main
167,machine  chest press,middle chest; shoulder; tricep,male; female,Muscle gain,Gym,"The Machine  chest Press is a strength training exercise performed on a specialized machine designed for  chest workouts. You sit down with your back against the support, grasp the handles, and push the weights forward until your arms are fully extended. This exercise primarily targets the pectoral muscles, while also engaging the triceps and shoulders for support. It provides stability and is ideal for beginners and those looking to isolate the  chest muscles effectively.",https://www.youtube.com/watch?v=NwzUje3z0qY,Easy,4,12,3,60,Main
168,plate squeeze press,middle chest; shoulder,male,Muscle gain,Gym; Home,"The Svend Press, or Plate Squeeze Press, is an exercise that targets the  chest and shoulders. To perform it, hold a weight plate with both hands, pressing it together in front of your  chest while extending your arms outward. The squeezing action engages the  chest muscles, while the pressing motion helps develop shoulder stability. It can be performed standing or seated and is effective for building upper body strength and enhancing muscle activation in the pectorals.",https://www.youtube.com/watch?v=cIoUZOnypS8,Easy,4,12,3,60,Main
169,resistance band  chest press,middle chest; shoulder; tricep,female,Muscle gain; Endurance,Home,"The Resistance Band  chest Press is an exercise that targets the  chest, shoulders, and triceps. To perform it, anchor a resistance band behind you at  chest level, hold the handles, and stand with your feet shoulder-width apart. Press the bands forward until your arms are fully extended, then return to the starting position. This exercise effectively mimics the motion of a bench press while providing variable resistance throughout the movement.",https://www.youtube.com/watch?v=po8JwkjexbU,Easy,4,12,3,60,Main
170,standing arm torso twist,ABS,male;female,Muscle gain,Gym;Home,"Stand with feet shoulder-width apart, knees slightly bent, holding a medicine ball (or dumbbell) in both hands. Keeping shoulders down, engage abs, bend elbows slightly and rotate torso to right until arms are in line with body",https://youtu.be/QQMri8bsjy8?si=8ZkWXPhDSge7xBh1,Easy,1,12,3,15,Warm-up
171,standing side bend ,ABS,male;female,Muscle gain,Gym;Home,"Stand with your feet shoulder width apart. Put your left hand behind your head and your right hand at your side. Bend your body to the right and lower your right hand towards the floor. Return, switch side and repeat",https://youtube.com/shorts/Vko-SJok-fk?si=7mbL62Amk-X_ew0l,Easy,1,12,3,15,Warm-up
172,arm circle ,shoulder,male;female,Endurance,Gym;Home,"Rotate your arm in a small circle, then gradually increase it. Warm up your shoulder muscles and arm joints",https://youtu.be/UVMEnIaY8aU?si=gTNUj4c6stBdYdal,Easy,1,20,3,15,Warm-up
173,leg swing,leg,male;female,Endurance,Gym;Home,"Stand straight, swing your legs back and forth in a front-to-back or horizontal direction. Warm up your hips and leg muscles.",https://youtu.be/E68-pMl1Im8?si=ifcD4Bp580_aVENk,Easy,1,16,3,15,Warm-up
174,hip rotation,leg,male;female,Endurance,Gym;Home,"Raise one leg and rotate your hips to move your leg to the side as if you were stepping over a fence. Put your foot down, then switch to the other foot.",https://youtube.com/shorts/f856Ja3Erss?si=6qKIM9_K25DTIcmB,Easy,1,12,3,15,Warm-up
175,shoulder circle,shoulder,male;female,Muscle gain,Gym;Home,Slowly lift your shoulders toward your ears. Roll them forward in a circular motion,https://youtu.be/shcSlZEnNp0?si=b-qhgI_OR5Yg1Qym,Easy,1,12,3,15,Warm-up
176,tricep stretch,shoulder; tricep,male;female,Endurance,Gym;Home,"Raise one arm straight overhead. Bend your elbow to bring your hand behind your head, reaching down between your shoulder blades.",https://youtu.be/zzvDO56B0HE?si=g64_CvvJcbLcfCJD,Easy,1,1,30,0,Relax
177,standing quad stretch,leg,male;female,Endurance,Gym;Home,Shift your weight onto one leg. Bend the opposite knee and bring your heel toward your buttocks. Grasp your ankle or the top of your foot with your hand.,https://youtu.be/FBO9-8nTbsM?si=O41PeNwHGj2TV9jy,Easy,1,1,30,0,Relax
178,child pose,leg;back,male;female,Endurance,Gym;Home,"Slowly lower your torso forward, reaching your arms out in front of you. Rest your forehead on the mat or floor.",https://youtu.be/nMp3MlTz9fA?si=rmrnJRQkiYMs3iRN,Easy,1,1,30,0,Relax
179,cobra pose,back,male;female,Endurance,Gym;Home,"Lie face down on the floor with your legs extended straight back, feet hip-width apart, and tops of your feet pressing into the mat. Place your hands under your shoulders with your elbows close to your body.",https://youtu.be/JDcdhTuycOI?si=EaanAp2cFXhPRbm8,Easy,1,1,30,0,Relax
180,chest opener,arm,male;female,Endurance,Gym;Home,"Stand or sit up straight with your feet hip-width apart, shoulders relaxed, and arms at your sides. Take a deep breath in to help you prepare for the stretch.",https://youtu.be/RcKjVRw-LfI?si=7KYP4VqEQL4Fz6vr,Easy,1,1,30,0,Relax
